{
  "schema_version": "1.0",
  "run_id": "example-run",
  "state": "completed",
  "updated_wall_time": "2026-10-20T00:00:00+05:30",
  "failure": null,
  "last_event_sequence": 12,
  "artifacts": [
    {
      "path": "events.jsonl",
      "byte_count": 12400,
      "sha256": "0123456789abcdef0123456789abcdef0123456789abcdef0123456789abcdef"
    }
  ]
}
